{
  "schemaVersion": "1.0.0",
  "generatedFrom": "4b8dbfd001e0e25fdb833e0c96c08dd42e03af9b",
  "source": "https://github.com/ssgberk/ssg-frameworks",
  "generators": [
    {
      "id": "analog",
      "path": "JavaScript/analog",
      "version": "2.8.0",
      "name": "Analog",
      "description": "Analog is a meta-framework for Angular, built on Vite and Nitro, that prerenders file-based routes to static HTML.",
      "homepage": "https://analogjs.org/",
      "repository": "https://github.com/analogjs/analog",
      "license": "MIT",
      "language": "TypeScript",
      "runtime": "Node.js 24.21.0",
      "templateEngines": [
        "Angular templates"
      ],
      "contentFormats": [
        "markdown"
      ],
      "category": "framework",
      "firstRelease": 2022,
      "maintained": true,
      "versionFrom": {
        "source": "npm",
        "name": "@analogjs/platform"
      },
      "benchmark": {
        "status": "active",
        "displayName": "analog",
        "versus": "javascript",
        "contentType": "3minus",
        "contentFolder": "src/content/posts",
        "buildCommand": "npx vite build",
        "outputFolder": "dist/analog/public",
        "outputGlob": "posts/*/index.html",
        "cacheFolders": [
          "dist",
          "node_modules/.vite",
          ".angular/cache",
          "node_modules/.cache"
        ]
      },
      "notes": "firstRelease from npm @analogjs/platform creation (2022-11-17). Markdown rendering is the official @analogjs/content package (marked). Built with static prerender of every post route and no SSR server.",
      "files": {
        "dockerfile": "https://raw.githubusercontent.com/ssgberk/ssg-frameworks/master/JavaScript/analog/analog.dockerfile",
        "benchmarkConfig": "https://raw.githubusercontent.com/ssgberk/ssg-frameworks/master/JavaScript/analog/benchmark_config.json",
        "readme": "https://raw.githubusercontent.com/ssgberk/ssg-frameworks/master/JavaScript/analog/README.md",
        "generatorJson": "https://raw.githubusercontent.com/ssgberk/ssg-frameworks/master/JavaScript/analog/generator.json"
      }
    },
    {
      "id": "antora",
      "path": "JavaScript/antora",
      "version": "3.2.1",
      "name": "Antora",
      "description": "Antora is a multi-repository documentation site generator for AsciiDoc content stored in git, built on Asciidoctor.js.",
      "homepage": "https://antora.org",
      "repository": "https://gitlab.com/antora/antora",
      "license": "MPL-2.0",
      "language": "JavaScript",
      "runtime": "Node.js 24.21.0",
      "templateEngines": [
        "Handlebars"
      ],
      "contentFormats": [
        "asciidoc"
      ],
      "category": "docs",
      "firstRelease": 2017,
      "maintained": true,
      "versionFrom": {
        "source": "npm",
        "name": "@antora/cli"
      },
      "benchmark": {
        "status": "active",
        "displayName": "antora",
        "versus": "javascript",
        "contentType": "none",
        "contentFolder": "modules/ROOT/pages/posts",
        "buildCommand": "npx antora --quiet antora-playbook.yml",
        "outputFolder": "build/site",
        "outputGlob": "posts/*.html",
        "cacheFolders": [
          ".cache/antora"
        ]
      },
      "notes": "Antora reads only AsciiDoc from git content sources. The benchmark posts are the canonical markdown; a local extension (ssgberk-md-adapter.js) converts them to AsciiDoc in memory inside the single Antora process and generates the index page. The UI bundle is a minimal local zip built in the image.",
      "files": {
        "dockerfile": "https://raw.githubusercontent.com/ssgberk/ssg-frameworks/master/JavaScript/antora/antora.dockerfile",
        "benchmarkConfig": "https://raw.githubusercontent.com/ssgberk/ssg-frameworks/master/JavaScript/antora/benchmark_config.json",
        "readme": "https://raw.githubusercontent.com/ssgberk/ssg-frameworks/master/JavaScript/antora/README.md",
        "generatorJson": "https://raw.githubusercontent.com/ssgberk/ssg-frameworks/master/JavaScript/antora/generator.json"
      }
    },
    {
      "id": "astro",
      "path": "JavaScript/astro",
      "version": "7.3.5",
      "name": "Astro",
      "description": "Astro is a web framework that renders component-based pages to static HTML at build time.",
      "homepage": "https://astro.build/",
      "repository": "https://github.com/withastro/astro",
      "license": "MIT",
      "language": "JavaScript",
      "runtime": "Node.js 24.21.0",
      "templateEngines": [
        "Astro components"
      ],
      "contentFormats": [
        "markdown",
        "mdx"
      ],
      "category": "framework",
      "firstRelease": 2021,
      "maintained": true,
      "benchmark": {
        "status": "active",
        "displayName": "astro",
        "versus": "javascript",
        "contentType": "3minus",
        "contentFolder": "src/content/posts",
        "buildCommand": "npx astro build --silent",
        "outputFolder": "dist",
        "outputGlob": "posts/*/index.html",
        "cacheFolders": [
          ".astro",
          "node_modules/.astro",
          "node_modules/.vite"
        ]
      },
      "notes": "GitHub's license API returns NOASSERTION; MIT verified from the LICENSE file, packages/astro/package.json and the npm registry. firstRelease from npm astro creation (2021-03-13); the oldest GitHub release is 2021-08-05. MDX is the official @astrojs/mdx integration; this setup uses Markdown only.",
      "files": {
        "dockerfile": "https://raw.githubusercontent.com/ssgberk/ssg-frameworks/master/JavaScript/astro/astro.dockerfile",
        "benchmarkConfig": "https://raw.githubusercontent.com/ssgberk/ssg-frameworks/master/JavaScript/astro/benchmark_config.json",
        "readme": "https://raw.githubusercontent.com/ssgberk/ssg-frameworks/master/JavaScript/astro/README.md",
        "generatorJson": "https://raw.githubusercontent.com/ssgberk/ssg-frameworks/master/JavaScript/astro/generator.json"
      }
    },
    {
      "id": "bridgetown",
      "path": "Ruby/bridgetown",
      "version": "2.2.2",
      "name": "Bridgetown",
      "description": "Bridgetown is a Ruby static site generator that builds sites from Markdown and Liquid or ERB templates, with an optional frontend bundler.",
      "homepage": "https://www.bridgetownrb.com",
      "repository": "https://github.com/bridgetownrb/bridgetown",
      "license": "MIT",
      "language": "Ruby",
      "runtime": "Ruby 3.4.9 (built from source on Ubuntu 24.04)",
      "templateEngines": [
        "Liquid",
        "ERB"
      ],
      "contentFormats": [
        "markdown",
        "html"
      ],
      "category": "general",
      "firstRelease": 2020,
      "maintained": true,
      "benchmark": {
        "status": "active",
        "displayName": "bridgetown",
        "versus": "ruby",
        "contentType": "3minus",
        "contentFolder": "content/_posts",
        "buildCommand": "bundle exec bridgetown build",
        "outputFolder": "output",
        "outputGlob": "posts/*/index.html",
        "cacheFolders": [
          ".bridgetown-cache"
        ]
      },
      "notes": "Bridgetown 2.2 requires Ruby 3.3 or newer, so the image builds Ruby 3.4.9 from source (Ubuntu 24.04 ships 3.2). The site has no frontend bundler (no esbuild or Node). Markdown via kramdown with the Rouge highlighter off. firstRelease from the oldest RubyGems version, 0.1.0 (2020-04-07).",
      "files": {
        "dockerfile": "https://raw.githubusercontent.com/ssgberk/ssg-frameworks/master/Ruby/bridgetown/bridgetown.dockerfile",
        "benchmarkConfig": "https://raw.githubusercontent.com/ssgberk/ssg-frameworks/master/Ruby/bridgetown/benchmark_config.json",
        "readme": "https://raw.githubusercontent.com/ssgberk/ssg-frameworks/master/Ruby/bridgetown/README.md",
        "generatorJson": "https://raw.githubusercontent.com/ssgberk/ssg-frameworks/master/Ruby/bridgetown/generator.json"
      }
    },
    {
      "id": "cecil",
      "path": "PHP/cecil",
      "version": "9.9.1",
      "name": "Cecil",
      "description": "Cecil is a PHP static site generator that turns Markdown content and Twig templates into a static website.",
      "homepage": "https://cecil.app",
      "repository": "https://github.com/Cecilapp/Cecil",
      "license": "MIT",
      "language": "PHP",
      "runtime": "PHP 8.3 (Ubuntu 24.04)",
      "templateEngines": [
        "Twig"
      ],
      "contentFormats": [
        "markdown"
      ],
      "category": "general",
      "firstRelease": 2013,
      "maintained": true,
      "benchmark": {
        "status": "active",
        "displayName": "Cecil",
        "versus": "php",
        "contentType": "3minus",
        "contentFolder": "pages/posts",
        "buildCommand": "vendor/bin/cecil build --quiet",
        "outputFolder": "_site",
        "outputGlob": "posts/*/index.html",
        "cacheFolders": [
          ".cache"
        ]
      },
      "notes": "Installed from Packagist as cecil/cecil.",
      "files": {
        "dockerfile": "https://raw.githubusercontent.com/ssgberk/ssg-frameworks/master/PHP/cecil/cecil.dockerfile",
        "benchmarkConfig": "https://raw.githubusercontent.com/ssgberk/ssg-frameworks/master/PHP/cecil/benchmark_config.json",
        "readme": "https://raw.githubusercontent.com/ssgberk/ssg-frameworks/master/PHP/cecil/README.md",
        "generatorJson": "https://raw.githubusercontent.com/ssgberk/ssg-frameworks/master/PHP/cecil/generator.json"
      }
    },
    {
      "id": "cobalt",
      "path": "Rust/cobalt",
      "version": "0.20.4",
      "name": "Cobalt",
      "description": "Cobalt is a static site generator written in Rust that renders Markdown with Liquid templates.",
      "homepage": "https://cobalt-org.github.io/",
      "repository": "https://github.com/cobalt-org/cobalt.rs",
      "license": "MIT OR Apache-2.0",
      "language": "Rust",
      "runtime": "Rust binary (release tarball)",